{
  "schema_version": "v1.2",
  "agent": "quant-performance-auditor-deep",
  "model_fingerprint": "sonnet",
  "run_at_utc": "2026-10-18T06-37-35Z",
  "verdict": "INSUFFICIENT_DATA",
  "summary": "claude CLI not available in this runner — placeholder result.",
  "claims": [],
  "warnings": [],
  "log": []
}
